{
  "schemaVersion": 2,
  "kind": "portable-verification-registry",
  "groups": [
    "web",
    "python",
    "mcp",
    "quick",
    "portable",
    "windows"
  ],
  "globalPaths": [
    "AGENTS.md",
    "**/AGENTS.md",
    "SECURITY.md",
    "**/SECURITY.md",
    ".github/**",
    ".agents/**",
    ".codex/**",
    ".claude/**",
    "package.json",
    "package-lock.json",
    ".npmrc",
    ".nvmrc",
    ".env*",
    "appwrite.config.json*",
    "environments/**",
    "platform/**"
  ],
  "prosePatterns": [
    "**/*.md",
    "*.md"
  ],
  "ignoredPaths": [
    ".gitignore",
    ".gitattributes",
    ".cursorignore"
  ],
  "suites": [
    {
      "id": "web-eslint",
      "group": "web",
      "owner": "web-and-catalog",
      "paths": [
        "apps/web/**",
        "packages/catalog/**",
        "tools/build/**",
        "packages/contracts/**"
      ],
      "consumers": [],
      "command": {
        "executable": "{node}",
        "args": [
          "node_modules/eslint/bin/eslint.js",
          "src/"
        ],
        "cwd": "apps/web"
      },
      "capabilities": [
        "node-24"
      ],
      "collection": {
        "format": "exit-code",
        "minimumTests": 0,
        "required": true
      },
      "expectedSkips": [],
      "timeoutMs": 900000,
      "ci": true,
      "profiles": [
        "changes",
        "repository"
      ],
      "reason": "Maintained web-eslint assertions"
    },
    {
      "id": "web-typecheck",
      "group": "web",
      "owner": "web-and-catalog",
      "paths": [
        "apps/web/**",
        "packages/catalog/**",
        "tools/build/**",
        "packages/contracts/**"
      ],
      "consumers": [],
      "command": {
        "executable": "{node}",
        "args": [
          "apps/web/node_modules/typescript/bin/tsc",
          "-b",
          "apps/web/tsconfig.json"
        ]
      },
      "capabilities": [
        "node-24"
      ],
      "collection": {
        "format": "exit-code",
        "minimumTests": 0,
        "required": true
      },
      "expectedSkips": [],
      "timeoutMs": 900000,
      "ci": true,
      "profiles": [
        "changes",
        "repository"
      ],
      "reason": "Maintained web-typecheck assertions"
    },
    {
      "id": "web-build",
      "group": "web",
      "owner": "web-and-catalog",
      "paths": [
        "apps/web/**",
        "packages/catalog/**",
        "tools/build/**",
        "packages/contracts/**"
      ],
      "consumers": [],
      "command": {
        "executable": "{node}",
        "args": [
          "verification/core/build-check.mjs"
        ]
      },
      "capabilities": [
        "node-24"
      ],
      "collection": {
        "format": "exit-code",
        "minimumTests": 0,
        "required": true
      },
      "expectedSkips": [],
      "timeoutMs": 900000,
      "ci": true,
      "profiles": [
        "changes",
        "repository"
      ],
      "reason": "Maintained web-build assertions"
    },
    {
      "id": "web-unit",
      "group": "web",
      "owner": "web-and-catalog",
      "paths": [
        "apps/web/**",
        "packages/catalog/**",
        "tools/build/**",
        "packages/contracts/**",
        "docs/features/feature-manifest.json"
      ],
      "consumers": [],
      "command": {
        "executable": "{node}",
        "args": [
          "node_modules/vitest/vitest.mjs",
          "run",
          "--reporter=junit",
          "--outputFile={output}/junit.xml"
        ],
        "cwd": "apps/web"
      },
      "capabilities": [
        "node-24",
        "python-3.12"
      ],
      "collection": {
        "format": "pytest-junit",
        "minimumTests": 1,
        "required": true,
        "reportPath": "{output}/junit.xml"
      },
      "expectedSkips": [],
      "timeoutMs": 900000,
      "ci": true,
      "profiles": [
        "changes",
        "repository"
      ],
      "reason": "Maintained web-unit assertions"
    },
    {
      "id": "catalog-check",
      "group": "web",
      "owner": "web-and-catalog",
      "paths": [
        "packages/catalog/**",
        "tools/build/bundle-catalog*"
      ],
      "consumers": [
        "web-unit",
        "web-build",
        "python-product-contracts",
        "native-sql"
      ],
      "command": {
        "executable": "{node}",
        "args": [
          "tools/build/bundle-catalog.mjs",
          "--check"
        ]
      },
      "capabilities": [
        "node-24"
      ],
      "collection": {
        "format": "exit-code",
        "minimumTests": 0,
        "required": true
      },
      "expectedSkips": [],
      "timeoutMs": 900000,
      "ci": true,
      "profiles": [
        "changes",
        "repository"
      ],
      "reason": "Maintained catalog-check assertions"
    },
    {
      "id": "python-product-contracts",
      "group": "python",
      "owner": "python",
      "paths": [
        "dev/tests/**",
        "services/appwrite-functions/**",
        "packages/backend-core-py/**"
      ],
      "consumers": [],
      "command": {
        "executable": "{python}",
        "args": [
          "-m",
          "pytest",
          "-p",
          "verification.portable.pytest_reporter",
          "dev/tests",
          "--ignore=dev/tests/scenarios",
          "-q",
          "--tb=short",
          "-p",
          "no:cacheprovider",
          "--junitxml={output}/junit.xml"
        ],
        "env": {
          "PYTHONPATH": "{root}{pathsep}{root}/packages/backend-core-py/src{pathsep}{root}/services/execution-worker-py",
          "PIP_NO_INDEX": "1",
          "PIP_DISABLE_PIP_VERSION_CHECK": "1"
        }
      },
      "capabilities": [
        "python-3.12"
      ],
      "collection": {
        "format": "pytest-junit",
        "minimumTests": 1,
        "required": true,
        "reportPath": "{output}/junit.xml"
      },
      "expectedSkips": [],
      "timeoutMs": 900000,
      "ci": true,
      "profiles": [
        "changes",
        "repository"
      ],
      "reason": "Maintained python-product-contracts assertions"
    },
    {
      "id": "backend-core-unit",
      "group": "python",
      "owner": "backend-core",
      "paths": [
        "packages/backend-core-py/**",
        "packages/contracts/**"
      ],
      "consumers": [],
      "command": {
        "executable": "{python}",
        "args": [
          "-m",
          "pytest",
          "-p",
          "verification.portable.pytest_reporter",
          "packages/backend-core-py/tests",
          "--ignore=packages/backend-core-py/tests/sql",
          "-q",
          "--tb=short",
          "-p",
          "no:cacheprovider",
          "--junitxml={output}/junit.xml"
        ],
        "env": {
          "PYTHONPATH": "{root}{pathsep}{root}/packages/backend-core-py/src{pathsep}{root}/services/execution-worker-py",
          "PIP_NO_INDEX": "1",
          "PIP_DISABLE_PIP_VERSION_CHECK": "1"
        }
      },
      "capabilities": [
        "python-3.12"
      ],
      "collection": {
        "format": "pytest-junit",
        "minimumTests": 1,
        "required": true,
        "reportPath": "{output}/junit.xml"
      },
      "expectedSkips": [],
      "timeoutMs": 900000,
      "ci": true,
      "profiles": [
        "changes",
        "repository"
      ],
      "reason": "Maintained backend-core-unit assertions"
    },
    {
      "id": "sql-offline",
      "group": "python",
      "owner": "backend-core",
      "paths": [
        "packages/backend-core-py/**"
      ],
      "consumers": [],
      "command": {
        "executable": "{python}",
        "args": [
          "-m",
          "pytest",
          "-p",
          "verification.portable.pytest_reporter",
          "packages/backend-core-py/tests/sql/test_codec_boundary.py",
          "packages/backend-core-py/tests/sql/test_store_unit.py",
          "packages/backend-core-py/tests/sql/test_m1_pool_unit.py",
          "packages/backend-core-py/tests/sql/test_m1_runtime.py",
          "packages/backend-core-py/tests/sql/test_m1_driver_packaging.py",
          "packages/backend-core-py/tests/sql/test_m2_admission_types.py",
          "-q",
          "--tb=short",
          "-p",
          "no:cacheprovider",
          "--junitxml={output}/junit.xml"
        ],
        "env": {
          "PYTHONPATH": "{root}{pathsep}{root}/packages/backend-core-py/src{pathsep}{root}/services/execution-worker-py",
          "PIP_NO_INDEX": "1",
          "PIP_DISABLE_PIP_VERSION_CHECK": "1"
        }
      },
      "capabilities": [
        "python-3.12"
      ],
      "collection": {
        "format": "pytest-junit",
        "minimumTests": 1,
        "required": true,
        "reportPath": "{output}/junit.xml"
      },
      "expectedSkips": [],
      "timeoutMs": 900000,
      "ci": true,
      "profiles": [
        "changes",
        "repository"
      ],
      "reason": "Maintained sql-offline assertions"
    },
    {
      "id": "python-functions",
      "group": "python",
      "owner": "appwrite-function-adapters",
      "paths": [
        "services/appwrite-functions/**",
        "packages/backend-core-py/**"
      ],
      "consumers": [],
      "command": {
        "executable": "{python}",
        "args": [
          "-m",
          "pytest",
          "-p",
          "verification.portable.pytest_reporter",
          "services/appwrite-functions/worker-cron-py/tests",
          "services/appwrite-functions/verification-email-py/tests",
          "services/appwrite-functions/connections-py/tests",